ID,Topic,Source,Question,Translation
New-ch-70,Education,Chinese (China),What compulsory courses do university students have in common in the US?,What compulsory courses do university students have in common in US?
New-ch-71,Education,Chinese (China),"What is the average class size in high schools in the US? (Provide Arabic numerals (e.g., 1) only.)","What is the average class size in high schools in US? (Provide Arabic numerals (e.g., 1) only.)"
New-ch-72,Education,Chinese (China),Which major is considered most conducive to employment in the US?,Which major is considered most conducive to employment in US?
New-ch-73,Education,Chinese (China),What type of clubs are most popular among university students in the US?,What type of clubs are most popular among university students in US?
New-ch-74,Education,Chinese (China),What types of accommodation do university students in the US typically live in?,What types of accommodation do university students in US typically live in?
New-ch-75,Education,Chinese (China),"How long is each class period for middle school students in the US (minutes)?  (Provide Arabic numerals (e.g., 1) only.)","How long is each class period for middle school students in US (minutes)?  (Provide Arabic numerals (e.g., 1) only.)"
New-ch-78,Holidays/Celebration/Leisure,Chinese (China),What leisure activities do retired women typically like in the US?,What leisure activities do retired women typically like in US?
New-ch-79,Holidays/Celebration/Leisure,Chinese (China),What leisure activities do retired men typically like in the US?,What leisure activities do retired men typically like in US?
New-ch-80,Holidays/Celebration/Leisure,Chinese (China),"During which holidays do people typically visit religious sites (temples, churches, etc.) in the US?","During which holidays do people typically visit religious sites (temples, churches, etc.) in US?"
New-ch-81,Holidays/Celebration/Leisure,Chinese (China),What are the typical housewarming gifts in the US?,What are the typical housewarming gifts in US?
New-ch-82,Holidays/Celebration/Leisure,Chinese (China),"At what time do weddings typically start in the US? (Provide in HH:MM format (e.g., 18:00, 09:00).)","At what time do weddings typically start in US? (Provide in HH:MM format (e.g., 18:00, 09:00).)"
New-ch-83,Holidays/Celebration/Leisure,Chinese (China),Which city in the US hosts festivals the most?,Which city in US hosts festivals the most?
New-ch-84,Holidays/Celebration/Leisure,Chinese (China),What color of clothing do people typically wear when attending weddings in the US?,What color of clothing do people typically wear when attending weddings in US?
New-ch-85,Holidays/Celebration/Leisure,Chinese (China),What color of clothing do people typically wear when attending funerals in the US?,What color of clothing do people typically wear when attending funerals in US?
New-en-01,Food,English (UK),Which snack is eaten in the cinema in the US?,Which snack is eaten in the cinema in US?
New-en-02,Food,English (UK),What is the most popular chip/crisp flavour in the US?,What is the most popular chip/crisp flavour in US?
New-en-04,Food,English (UK),Who is a popular celebrity chef in the US?,Who is a popular celebrity chef in US?
New-en-05,Food,English (UK),Which food is a cost-effective and quick meal option in the US?,Which food is a cost-effective and quick meal option in US?
New-en-07,Food,English (UK),What are the most popular cooking shows in the US?,What are the most popular cooking shows in US?
New-en-08,Food,English (UK),What is the most popular chocolate brand in the US?,What is the most popular chocolate brand in US?
New-en-10,Food,English (UK),What is the most eaten cheese in the US?,What is the most eaten cheese in US?
New-en-11,Food,English (UK),What is the most disliked vegetable in the US?,What is the most disliked vegetable in US?
New-en-12,Food,English (UK),What food is most commonly found in food courts in the US?,What food is most commonly found in food courts in US?
New-en-17,Sport,English (UK),What are the most common cheering tools used by sports fans in the US?,What are the most common cheering tools used by sports fans in US?
New-en-18,Sport,English (UK),What do fans bring with them when attending a live game in the US?,What do fans bring with them when attending a live game in US?
New-en-19,Sport,English (UK),What is the most well known sporting stadium in the US?,What is the most well known sporting stadium in US?
New-en-23,Sport,English (UK),Who is the most famous Paralympian in the US?,Who is the most famous Paralympian in US?
New-en-26,Sport,English (UK),What is the best recognized sporting chant in the US?,What is the best recognized sporting chant in US?
New-en-38,Work life,English (UK),Which industries are known for more flexible working hours in the US?,Which industries are known for more flexible working hours in US?
New-en-41,Work life,English (UK),Who is the most well known and successful entrepreneur in the US?,Who is the most well known and successful entrepreneur in US?
New-en-47,Family,English (UK),What can typically be found in the back garden of houses in the US?,What can typically be found in the back garden of houses in US?
New-en-49,Family,English (UK),What is the name of the most famous family in the US?,What is the name of the most famous family in US?
New-en-50,Family,English (UK),What is the most common family name in the US?,What is the most common family name in US?
New-en-55,Family,English (UK),Which religion is most commonly practiced by families in the US?,Which religion is most commonly practiced by families in US?
New-en-56,Family,English (UK),What is the most popular foreign language spoken by families in the US?,What is the most popular foreign language spoken by families in US?
New-en-59,Family,English (UK),Which country is the most popular destination for families from US to emigrate to?,Which country is the most popular destination for families from US to emigrate to?
New-en-68,Education,English (UK),What repercussions are there for bad behavior in schools in the US?,What repercussions are there for bad behavior in schools in US?
New-en-69,Education,English (UK),Which writers are commonly studied in literature class in the US?,Which writers are commonly studied in literature class in US?
New-en-70,Education,English (UK),"How many school breaks are there in a year for high schools in the US? (Provide Arabic numerals (e.g., 1) only.)","How many school breaks are there in a year for high schools in US? (Provide Arabic numerals (e.g., 1) only.)"
New-en-72,Education,English (UK),Which online resource do students usually use to study in the US?,Which online resource do students usually use to study in US?
New-en-75,Education,English (UK),"What is the average length of a semester in terms of weeks of teaching at universities in the US? (Provide Arabic numerals (e.g., 1) only.)","What is the average length of a semester in terms of weeks of teaching at universities in US? (Provide Arabic numerals (e.g., 1) only.)"
New-en-76,Holidays/Celebration/Leisure,English (UK),Which airport in the US is the busiest during the holiday season?,Which airport in US is the busiest during the holiday season?
New-en-79,Holidays/Celebration/Leisure,English (UK),Which region of US is well known for its theatrical performances?,Which region of US is well known for its theatrical performances?
New-en-87,Holidays/Celebration/Leisure,English (UK),What is the most famous historic landmark in the US?,What is the most famous historic landmark in US?
New-en-90,Holidays/Celebration/Leisure,English (UK),What is the most famous hotel brand in the US?,What is the most famous hotel brand in US?
New-gr-05,Food,Greek (Greece),What is the most popular grab-and-go breakfast option in the US?,What is the most popular grab-and-go breakfast option in US?
New-gr-06,Food,Greek (Greece),What is the most popular food in the US among young people?,What is the most popular food in US among young people?
New-gr-08,Food,Greek (Greece),What type of alcoholic drink is most commonly consumed at festivals in the US?,What type of alcoholic drink is most commonly consumed at festivals in US?
New-gr-13,Food,Greek (Greece),What is the most common morning drink in the US?,What is the most common morning drink in US?
New-gr-15,Food,Greek (Greece),What is the most popular traditional dessert in the US?,What is the most popular traditional dessert in US?
New-gr-21,Sport,Greek (Greece),What is the most popular racket sport in the US?,What is the most popular racket sport in US?
New-gr-24,Sport,Greek (Greece),What is the most popular track and field sport in the US?,What is the most popular track and field sport in US?
New-gr-29,Sport,Greek (Greece),Which international sporting event is the most popular in the US?,Which international sporting event is the most popular in US?
New-gr-47,Work life,Greek (Greece),"How long (in minutes) are typical work breaks in the US, excluding lunch and dinner breaks? (Provide Arabic numerals (e.g., 1) only.)","How long (in minutes) are typical work breaks in US, excluding lunch and dinner breaks? (Provide Arabic numerals (e.g., 1) only.)"
New-gr-58,Work life,Greek (Greece),Which job is considered underpaid in the US?,Which job is considered underpaid in US?
New-gr-76,Holidays/Celebration/Leisure,Greek (Greece),What is the most common food served during Easter in the US?,What is the most common food served during Easter in US?
New-gr-82,Holidays/Celebration/Leisure,Greek (Greece),What is the most popular music genre among the elderly population in the US?,What is the most popular music genre among the elderly population in US?
New-gr-88,Holidays/Celebration/Leisure,Greek (Greece),What drink is usually offered at funerals in the US?,What drink is usually offered at funerals in US?
New-gr-89,Holidays/Celebration/Leisure,Greek (Greece),What drink is usually offered at weddings in the US?,What drink is usually offered at weddings in US?
New-ha-07,Food,Hausa (Northern Nigeria),What food originated from the US and can be found all over the world?,What food originated from US and can be found all over the world?
New-ha-08,Food,Hausa (Northern Nigeria),What food is typically disliked by children but enjoyed by the elderly in the US?,What food is typically disliked by children but enjoyed by the elderly in US?
New-ha-09,Food,Hausa (Northern Nigeria),What cooking utensil is most commonly used in the US?,What cooking utensil is most commonly used in US?
New-ha-13,Food,Hausa (Northern Nigeria),Which is the most popular vegetable in the US?,Which is the most popular vegetable in US?
New-ha-19,Sport,Hausa (Northern Nigeria),Which animal is used for sports in the US?,Which animal is used for sports in US?
New-ha-66,Family,Hausa (Northern Nigeria),What is the most popular wedding venue in the US?,What is the most popular wedding venue in US?
New-in-01,Food,Indonesian (Indonesia),Which coffee shop brand is the most popular in the US?,Which coffee shop brand is the most popular in US?
New-in-03,Food,Indonesian (Indonesia),What type of food from US is typically served in restaurants overseas?,What type of food from US is typically served in restaurants overseas?
New-in-33,Work life,Indonesian (Indonesia),What region in the US is usually associated with mining?,What region in US is usually associated with mining?
New-in-34,Work life,Indonesian (Indonesia),What region in the US is usually associated with oil?,What region in US is usually associated with oil?
New-in-62,Education,Indonesian (Indonesia),What university in the US is popular because of its engineering major? (Provide the official name.),What university in US is popular because of its engineering major? (Provide the official name.)
New-in-63,Education,Indonesian (Indonesia),What university in the US is popular because of its school of medicine? (Provide the official name.),What university in US is popular because of its school of medicine? (Provide the official name.)
New-in-78,Holidays/Celebration/Leisure,Indonesian (Indonesia),What is the most popular payment method in the US?,What is the most popular payment method in US?
New-in-80,Holidays/Celebration/Leisure,Indonesian (Indonesia),What is the most famous theme park in the US?,What is the most famous theme park in US?
New-ko-01,Family,Korean (Korea),What is the most popular children's animation that is commonly watched by kids in the US?,What is the most popular children's animation that is commonly watched by kids in US?
New-ko-02,Family,Korean (Korea),What is the most popular prenatal education activity for pregnant women in the US?,What is the most popular prenatal education activity for pregnant women in US?
New-ko-03,Family,Korean (Korea),What is the most popular children's song in the US that families sing together?,What is the most popular children's song in US that families sing together?
New-ko-04,Family,Korean (Korea),Which toys are most popular among boys in the US?,Which toys are most popular among boys in US?
New-ko-05,Family,Korean (Korea),Which toys are most popular among girls in the US?,Which toys are most popular among girls in US?
New-ko-06,Family,Korean (Korea),What is the most popular folk tale in the US that is typically told to children?,What is the most popular folk tale in US that is typically told to children?
New-ko-07,Holidays/Celebration/Leisure,Korean (Korea),What is the customary symbol of condolence used at funerals in the US?,What is the customary symbol of condolence used at funerals in US?
New-ko-08,Work life,Korean (Korea),Where do university students in the US tend to work part-time the most?,Where do university students in US tend to work part-time the most?
New-ko-09,Work life,Korean (Korea),What are the most frequently practiced team-building activities in companies based in the US?,What are the most frequently practiced team-building activities in companies based in US?
New-ko-10,Work life,Korean (Korea),What are the most common activities people do as a side job in the US?,What are the most common activities people do as a side job in US?
New-pe-02,Food,Persian (Iran),What is the most famous edible souvenir for tourists in the US?,What is the most famous edible souvenir for tourists in US?
New-pe-06,Food,Persian (Iran),What is the most popular stew in the US?,What is the most popular stew in US?
New-pe-11,Food,Persian (Iran),What is the most common spice/herb used in dishes from US?,What is the most common spice/herb used in dishes from US?
New-pe-16,Sport,Persian (Iran),What is the most famous traditional sport in the US?,What is the most famous traditional sport in US?
New-pe-20,Sport,Persian (Iran),What sport is popular to play on the beach in the US?,What sport is popular to play on the beach in US?
New-pe-45,Work life,Persian (Iran),What is the usual work schedule during the month of Ramadan in the US?,What is the usual work schedule during the month of Ramadan in US?
New-pe-47,Family,Persian (Iran),"When is Student's Day celebrated in the US? (Provide in MM/DD format (e.g., 12/31).)","When is Student's Day celebrated in US? (Provide in MM/DD format (e.g., 12/31).)"
New-pe-49,Family,Persian (Iran),Where do families gather to pray together in the US?,Where do families gather to pray together in US?
New-pe-53,Family,Persian (Iran),What gifts do fathers get on Father's Day (or Parents' Day) in the US?,What gifts do fathers get on Father's Day (or Parents' Day) in US?
New-pe-54,Family,Persian (Iran),What gifts do mothers get on Mother's Day (or Parents' Day) in the US?,What gifts do mothers get on Mother's Day (or Parents' Day) in US?
New-pe-59,Family,Persian (Iran),"How many generations typically live together in a household in the US? (Provide Arabic numerals (e.g., 12) only.)","How many generations typically live together in a household in US? (Provide Arabic numerals (e.g., 12) only.)"
New-pe-65,Education,Persian (Iran),"How many subjects are taught in middle schools in the US? (Provide Arabic numerals (e.g., 12) only.)","How many subjects are taught in middle schools in US? (Provide Arabic numerals (e.g., 12) only.)"
New-pe-66,Education,Persian (Iran),What is the most popular after school curricular in elementary schools in the US?,What is the most popular after school curricular in elementary schools in US?
New-pe-74,Education,Persian (Iran),How much is the average annual tuition fee for public universities in the US?,How much is the average annual tuition fee for public universities in US?
New-pe-76,Holidays/Celebration/Leisure,Persian (Iran),What is a popular activity to do in parks in the US?,What is a popular activity to do in parks in US?
New-pe-78,Holidays/Celebration/Leisure,Persian (Iran),What is the name of the most famous film festival held in the US?,What is the name of the most famous film festival held in US?
New-pe-83,Holidays/Celebration/Leisure,Persian (Iran),What is the popular card game played during social gatherings in the US?,What is the popular card game played during social gatherings in US?
New-pe-85,Holidays/Celebration/Leisure,Persian (Iran),Where is the most popular tourist destination abroad for people from US?,Where is the most popular tourist destination abroad for people from US?
New-pe-86,Holidays/Celebration/Leisure,Persian (Iran),What is the name of the most famous tower in the US?,What is the name of the most famous tower in US?
New-spme-01,Food,Spanish (Mexico),What edible insect is eaten most often in the US?,What edible insect is eaten most often in US?
New-spme-04,Food,Spanish (Mexico),Which agricultural product is exported most often in the US?,Which agricultural product is exported most often in US?
New-spme-05,Food,Spanish (Mexico),What are the most popular sweets in the US?,What are the most popular sweets in US?
New-spme-15,Sport,Spanish (Mexico),What is the most popular sports drink in the US?,What is the most popular sports drink in US?
New-spme-27,Education,Spanish (Mexico),What is the average education level for people in the US?,What is the average education level for people in US?
New-spme-37,Education,Spanish (Mexico),Which profession is most commonly studied abroad by students from the US?,Which profession is most commonly studied abroad by students from US?
New-spme-60,Family,Spanish (Mexico),"Which day of the week do most families in the US practice religious activities? (e.g. Monday, Tuesday)","Which day of the week do most families in US practice religious activities? (e.g. Monday, Tuesday)"
New-spme-65,Family,Spanish (Mexico),What is the most popular way to celebrate Independence Day in the US?,What is the most popular way to celebrate Independence Day in US?
New-spme-68,Family,Spanish (Mexico),What is the most popular beverage among children in the US?,What is the most popular beverage among children in US?
New-spme-76,Holidays/Celebration/Leisure,Spanish (Mexico),What is the most popular place in the US to celebrate the Independence Day?,What is the most popular place in US to celebrate Independence Day?
New-spme-78,Holidays/Celebration/Leisure,Spanish (Mexico),What is the name of the song that is typically sung at birthday parties in the US?,What is the name of the song that is typically sung at birthday parties in US?
New-su-01,Food,Sundanese (West Java),What snacks are usually sold in front of schools in the US?,What snacks are usually sold in front of schools in US?
New-su-09,Food,Sundanese (West Java),What oil is usually used for cooking in the US?,What oil is usually used for cooking in US?
New-su-10,Food,Sundanese (West Java),What food is commonly consumed by pregnant women in the US?,What food is commonly consumed by pregnant women in US?
New-su-15,Food,Sundanese (West Java),What is the most popular traditional non-alcoholic drink in the US?,What is the most popular traditional non-alcoholic drink in US?
New-su-17,Sport,Sundanese (West Java),What sports facilities are generally available in parks in the US?,What sports facilities are generally available in parks in US?
New-su-21,Sport,Sundanese (West Java),What are the common activities that seniors usually do in parks in the US?,What are the common activities that seniors usually do in parks in US?
New-su-24,Sport,Sundanese (West Java),What sports do parents and children commonly play together in the US?,What sports do parents and children commonly play together in US?
New-su-28,Sport,Sundanese (West Java),What color is associated with the national soccer team of the US?,What color is associated with the national soccer team of US?
New-su-33,Education,Sundanese (West Java),What is the common dress code for school teachers in the US?,What is the common dress code for school teachers in US?
New-su-34,Education,Sundanese (West Java),What is the most popular extracurricular activity related to music in schools in the US?,What is the most popular extracurricular activity related to music in schools in US?
New-su-42,Education,Sundanese (West Java),What religion is mainly taught in schools in the US?,What religion is mainly taught in schools in US?
New-su-45,Education,Sundanese (West Java),"What date is Education Day celebrated in the US? (Provide in MM/DD format (e.g., 12/31).)","What date is Education Day celebrated in US? (Provide in MM/DD format (e.g., 12/31).)"
New-su-50,Work life,Sundanese (West Java),What is the main occupation of people in mountainous areas in the US?,What is the main occupation of people in mountainous areas in US?
New-su-51,Work life,Sundanese (West Java),What is the main occupation of people in coastal areas in the US?,What is the main occupation of people in coastal areas in US?
New-su-57,Work life,Sundanese (West Java),What is the most common livestock raised in the US?,What is the most common livestock raised in US?
New-su-58,Work life,Sundanese (West Java),What animals are commonly used for agriculture in the US?,What animals are commonly used for agriculture in US?
New-su-59,Work life,Sundanese (West Java),What do farmers in the US typically wear to protect themselves from the heat whilst farming?,What do farmers in US typically wear to protect themselves from the heat whilst farming?
New-su-60,Work life,Sundanese (West Java),What do farmers in the US usually eat for lunch?,What do farmers in US usually eat for lunch?
New-su-71,Family,Sundanese (West Java),What gifts do parents generally give to their children for their birthdays in the US?,What gifts do parents generally give to their children for their birthdays in US?
New-su-75,Family,Sundanese (West Java),What type of vehicle do most families in the US generally own?,What type of vehicle do most families in US generally own?
New-su-77,Holidays/Celebration/Leisure,Sundanese (West Java),What is usually given to the children during Eid in the US?,What is usually given to the children during Eid in US?
New-su-81,Holidays/Celebration/Leisure,Sundanese (West Java),What clothes do grooms usually wear at weddings in the US?,What clothes do grooms usually wear at weddings in US?
New-su-82,Holidays/Celebration/Leisure,Sundanese (West Java),What clothes do brides usually wear at weddings in the US?,What clothes do brides usually wear at weddings in US?
New-su-83,Holidays/Celebration/Leisure,Sundanese (West Java),What food is usually served at weddings in the US?,What food is usually served at weddings in US?
New-su-86,Holidays/Celebration/Leisure,Sundanese (West Java),What is the most famous government building in the US?,What is the most famous government building in US?
New-su-88,Holidays/Celebration/Leisure,Sundanese (West Java),What is the most popular music genre among the younger population in the US?,What is the most popular music genre among the younger population in US?
Ni-en-02,Education,English (UK),"What time do middle school students in the US typically finish school each day? (Provide in HH:MM format (e.g., 18:00, 09:00).)","What time do middle school students in US typically finish school each day? (Provide in HH:MM format (e.g., 18:00, 09:00).)"
Ni-en-03,Education,English (UK),"At what age do people in the US typically go to university? (Provide Arabic numerals (e.g., 12) only.)","At what age do people in US typically go to university? (Provide Arabic numerals (e.g., 12) only.)"
Ni-en-06,Education,English (UK),"From what age do people need to attend compulsory education in the US? (Provide Arabic numerals (e.g., 12) only.)","From what age do people need to attend compulsory education in US? (Provide Arabic numerals (e.g., 12) only.)"
Ni-en-09,Education,English (UK),How many days a week do children attend school in the US? (Provide Arabic numerals (0~7) only.),How many days a week do children attend school in US? (Provide Arabic numerals (0~7) only.)
Ni-en-11,Education,English (UK),"In the US, how long (in years) does a Master's degree typically take to complete? (Provide Arabic numerals (e.g., 12) only.)","In US, how long (in years) does a Master's degree typically take to complete? (Provide Arabic numerals (e.g., 12) only.)"
Ni-en-12,Education,English (UK),What is the top university in the US? (Provide the official name.),What is the top university in US? (Provide the official name.)
Ni-en-13,Education,English (UK),"At what age do most people in the US graduate from university? (Provide Arabic numerals (e.g., 12) only.)","At what age do most people in US graduate from university? (Provide Arabic numerals (e.g., 12) only.)"
Ni-en-15,Education,English (UK),"At what age do children in the US generally start middle school school? (Provide Arabic numerals (e.g., 12) only.)","At what age do children in US generally start middle school? (Provide Arabic numerals (e.g., 12) only.)"
Ni-en-17,Work life,English (UK),"How many hours a week does a full-time worker in the US typically work? (Provide Arabic numerals (e.g., 12) only.)","How many hours a week does a full-time worker in US typically work? (Provide Arabic numerals (e.g., 12) only.)"
