ID,Topic,Source,Question,Translation
Kik-in-01,Holidays/Celebration/Leisure,Indonesian (Indonesia),What national holiday has the longest duration in the US?,What national holiday has the longest duration in US?
Kik-in-02,Holidays/Celebration/Leisure,Indonesian (Indonesia),What are the common activities people from the US do to celebrate Independence day?,What are the common activities people from US do to celebrate Independence day?
Kik-in-04,Holidays/Celebration/Leisure,Indonesian (Indonesia),What is installed in front of the house when a family member dies in the US?,What is installed in front of the house when a family member dies in US?
Kik-in-05,Holidays/Celebration/Leisure,Indonesian (Indonesia),When is a pregnancy celebration or ceremony usually held in the US?,When is a pregnancy celebration or ceremony usually held in US?
Kik-in-06,Holidays/Celebration/Leisure,Indonesian (Indonesia),What event is usually held before a wedding in the US?,What event is usually held before a wedding in US?
Kik-in-07,Holidays/Celebration/Leisure,Indonesian (Indonesia),What is usually shared to the children during (Lunar) New Year in the US?,What is usually shared to the children during (Lunar) New Year in US?
Kik-in-08,Holidays/Celebration/Leisure,Indonesian (Indonesia),What activities are usually done days before Ramadan in the US?,What activities are usually done days before Ramadan in US?
Kik-in-10,Holidays/Celebration/Leisure,Indonesian (Indonesia),What is the most popular tourist attraction for foreign visitors in the US?,What is the most popular tourist attraction for foreign visitors in US?
Kik-in-11,Holidays/Celebration/Leisure,Indonesian (Indonesia),"What is the most popular religious sites (temple, church, etc.) for tourism in the US?","What is the most popular religious sites (temple, church, etc.) for tourism in US?"
Kik-in-15,Holidays/Celebration/Leisure,Indonesian (Indonesia),What clothes do women usually wear on graduation commencement ceremony in the US?,What clothes do women usually wear on graduation commencement ceremony in US?
Kik-in-16,Food,Indonesian (Indonesia),What drink is commonly consumed in the US when the weather is cold?,What drink is commonly consumed in US when the weather is cold?
Kik-in-17,Food,Indonesian (Indonesia),What fruit is more commonly sold and found during Ramadan in the US?,What fruit is more commonly sold and found during Ramadan in US?
Kik-in-24,Food,Indonesian (Indonesia),What carbohydrate is usually served with chicken in a fast-food restaurant in the US?,What carbohydrate is usually served with chicken in a fast-food restaurant in US?
Kik-in-31,Sport,Indonesian (Indonesia),What is the most famous martial art sports in the US?,What is the most famous martial art sports in US?
Kik-in-34,Sport,Indonesian (Indonesia),What sports are often broadcasted on national television in the US?,What sports are often broadcasted on national television in US?
Kik-in-35,Sport,Indonesian (Indonesia),What sports were popular among people from the US during the COVID-19 pandemic?,What sports were popular among people from US during the COVID-19 pandemic?
Kik-in-36,Sport,Indonesian (Indonesia),Who is the most popular soccer coach in the US?,Who is the most popular soccer coach in US?
Kik-in-37,Sport,Indonesian (Indonesia),What soccer teams in the US are famous for their intense rivalry? (e.g. ___ vs ___),What soccer teams in US are famous for their intense rivalry? (e.g. ___ vs ___)
Kik-in-38,Sport,Indonesian (Indonesia),What are the names of soccer supporters in the US who are famous for their intense rivalry? (e.g. ___ vs ___),What are the names of soccer supporters in US who are famous for their intense rivalry? (e.g. ___ vs ___)
Kik-in-40,Sport,Indonesian (Indonesia),Who is the most famous male badminton player in the US?,Who is the most famous male badminton player in US?
Kik-in-41,Sport,Indonesian (Indonesia),Who is the most famous female badminton player in the US?,Who is the most famous female badminton player in US?
Kik-in-44,Sport,Indonesian (Indonesia),What sport gets the most support from the government in the US?,What sport gets the most support from the government in US?
Kik-in-45,Sport,Indonesian (Indonesia),What sports field facilities are usually available at schools in the US?,What sports field facilities are usually available at schools in US?
Na-ko-02,Food,Korean (South Korea),What cafe beverage do people from the US most commonly enjoy?,What cafe beverage do people from US most commonly enjoy?
Na-ko-04,Food,Korean (South Korea),What is the preferred hangover cure food for people from the US?,What is the preferred hangover cure food for people from US?
Na-ko-05,Food,Korean (South Korea),What is the typical delivery food in the US?,What is the typical delivery food in US?
Na-ko-07,Food,Korean (South Korea),What type of meat is consumed most by people from the US?,What type of meat is consumed most by people from US?
Na-ko-08,Food,Korean (South Korea),What fruit do people from the US often eat in the autumn season?,What fruit do people from US often eat in the autumn season?
Na-ko-09,Food,Korean (South Korea),What side dish is the most commonly served on a dining table in the US?,What side dish is the most commonly served on a dining table in US?
Na-ko-11,Food,Korean (South Korea),What do people from the US eat while watching a soccer game?,What do people from US eat while watching a soccer game?
Na-ko-15,Food,Korean (South Korea),What is the representative nourishing food in the US?,What is the representative nourishing food in US?
Na-ko-16,Sport,Korean (South Korea),Who is the most famous soccer player in the US?,Who is the most famous soccer player in US?
Na-ko-17,Sport,Korean (South Korea),What sports do male students enjoy during lunch time at school in the US?,What sports do male students enjoy during lunch time at school in US?
Na-ko-18,Sport,Korean (South Korea),What is the most common sport girls participate in during physical education classes in the US?,What is the most common sport girls participate in during physical education classes in US?
Na-ko-19,Sport,Korean (South Korea),Who is the most popular volleyball player in the US?,Who is the most popular volleyball player in US?
Na-ko-20,Sport,Korean (South Korea),What sports event do people from the US passionately support the most in international competitions?,What sports event do people from US passionately support the most in international competitions?
Na-ko-22,Sport,Korean (South Korea),Which country is considered the biggest rival in soccer matches for the US?,Which country is considered the biggest rival in soccer matches for US?
Na-ko-23,Sport,Korean (South Korea),What type of sports academies do children attend the most in the US?,What type of sports academies do children attend the most in US?
Na-ko-24,Sport,Korean (South Korea),What is the most commonly eaten food in sports stadiums while watching games in the US?,What is the most commonly eaten food in sports stadiums while watching games in US?
Na-ko-25,Sport,Korean (South Korea),What are the typical sports played in the US's school sports day?,What are the typical sports played in US's school sports day?
Na-ko-26,Sport,Korean (South Korea),What are the popular sports among the middle-aged population in the US?,What are the popular sports among the middle-aged population in US?
Na-ko-28,Sport,Korean (South Korea),Who is the most popular winter sports player in the US?,Who is the most popular winter sports player in US?
Na-ko-29,Sport,Korean (South Korea),Who is the most famous swimmer in the US?,Who is the most famous swimmer in US?
Na-ko-30,Sport,Korean (South Korea),What is the most popular e-sports game in the US?,What is the most popular e-sports game in US?
Na-ko-33,Holidays/Celebration/Leisure,Korean (South Korea),What symbolic food do people from the US eat on (Lunar) New Year?,What symbolic food do people from US eat on (Lunar) New Year?
Na-ko-37,Holidays/Celebration/Leisure,Korean (South Korea),What is the most popular domestic vacation spot for people from the US?,What is the most popular domestic vacation spot for people from US?
Na-ko-38,Holidays/Celebration/Leisure,Korean (South Korea),What is the most common wedding gift between bride and groom in the US?,What is the most common wedding gift between bride and groom in US?
Na-ko-39,Holidays/Celebration/Leisure,Korean (South Korea),What is typically given as a congratulatory gesture when attending a friend's wedding in the US?,What is typically given as a congratulatory gesture when attending a friend's wedding in US?
Na-ko-40,Holidays/Celebration/Leisure,Korean (South Korea),"How long (in days) does a funeral typically last in the US? (Provide Arabic numerals (e.g., 12) only.)","How long (in days) does a funeral typically last in US? (Provide Arabic numerals (e.g., 12) only.)"
Na-ko-41,Holidays/Celebration/Leisure,Korean (South Korea),What should you prepare as a condolence offering when attending a funeral in the US?,What should you prepare as a condolence offering when attending a funeral in US?
Na-ko-42,Holidays/Celebration/Leisure,Korean (South Korea),What type of food is commonly provided at funeral parlors in the US?,What type of food is commonly provided at funeral parlors in US?
Na-ko-43,Holidays/Celebration/Leisure,Korean (South Korea),What do people do in the US in the morning of the (Lunar) New Year?,What do people do in US in the morning of the (Lunar) New Year?
Na-ko-44,Holidays/Celebration/Leisure,Korean (South Korea),When is the day with the US's most severe nationwide traffic congestion?,When is the day with US's most severe nationwide traffic congestion?
Na-ko-45,Holidays/Celebration/Leisure,Korean (South Korea),What is the most popular honeymoon destination in the US?,What is the most popular honeymoon destination in US?
Ne-ar-05,Holidays/Celebration/Leisure,Arabic (Algeria),What is the most important national holiday in the US?,What is the most important national holiday in US?
Ne-ar-06,Holidays/Celebration/Leisure,Arabic (Algeria),What do people from the US eat in Ramadan?,What do people from US eat in Ramadan?
Ne-ar-09,Holidays/Celebration/Leisure,Arabic (Algeria),What do people from the US eat in Eid ul Fitr?,What do people from US eat in Eid ul Fitr?
Ne-ar-10,Holidays/Celebration/Leisure,Arabic (Algeria),What do people from the US eat in Eid ul Adha?,What do people from US eat in Eid ul Adha?
Ne-ar-11,Holidays/Celebration/Leisure,Arabic (Algeria),Where do people from the US go to celebrate New Year's Day?,Where do people from US go to celebrate New Year's Day?
Ne-ar-14,Holidays/Celebration/Leisure,Arabic (Algeria),Where do a family gather for Eid festivities in the US?,Where do a family gather for Eid festivities in US?
Ne-ar-16,Work life,Arabic (Algeria),"When is the weekend in the US (e.g. Monday, Tuesday)?","When is the weekend in US (e.g. Monday, Tuesday)?"
Ne-ar-17,Work life,Arabic (Algeria),"At what time do most people start work in the US? (Provide in HH:MM format (e.g., 18:00, 09:00).)","At what time do most people start work in US? (Provide in HH:MM format (e.g., 18:00, 09:00).)"
Ne-ar-18,Work life,Arabic (Algeria),"At what time do most people finish work in the US? (Provide in HH:MM format (e.g., 18:00, 09:00).)","At what time do most people finish work in US? (Provide in HH:MM format (e.g., 18:00, 09:00).)"
Ne-ar-20,Work life,Arabic (Algeria),What is considered to be a secure job in the US?,What is considered to be a secure job in US?
Ne-ar-24,Work life,Arabic (Algeria),Which city is the primary commercial hub in the US?,Which city is the primary commercial hub in US?
Ne-ar-25,Work life,Arabic (Algeria),What is the industry that pays the best in the US?,What is the industry that pays the best in US?
Ne-ar-26,Work life,Arabic (Algeria),What is the most famous public corporation in the US?,What is the most famous public corporation in US?
Ne-ar-31,Food,Arabic (Algeria),What is the most famous dish in the US?,What is the most famous dish in US?
Ne-ar-32,Food,Arabic (Algeria),What do people usually have for breakfast in the US?,What do people usually have for breakfast in US?
Ne-ar-33,Food,Arabic (Algeria),"When do people usually have lunch in the US? (Provide in HH:MM format (e.g., 18:00, 09:00).)","When do people usually have lunch in US? (Provide in HH:MM format (e.g., 18:00, 09:00).)"
Ne-ar-34,Food,Arabic (Algeria),What is typically indispensable in meals in the US?,What is typically indispensable in meals in US?
Ne-ar-36,Food,Arabic (Algeria),What is a typical festive meal in the US?,What is a typical festive meal in US?
Ne-ar-37,Food,Arabic (Algeria),Which fruit do people usually offer tourists/visitors from abroad in the US?,Which fruit do people usually offer tourists/visitors from abroad in US?
Ne-ar-38,Food,Arabic (Algeria),Which food do people usually offer as charity in the US?,Which food do people usually offer as charity in US?
Ne-ar-39,Food,Arabic (Algeria),What is the cheapest fast food in the US?,What is the cheapest fast food in US?
Ne-ar-43,Food,Arabic (Algeria),What do people usually have with tea in the US?,What do people usually have with tea in US?
Ne-ar-44,Food,Arabic (Algeria),What do people have with coffee in the US?,What do people have with coffee in US?
New-am-02,Food,Amharic (Ethiopia),What is the most popular traditional food in the US?,What is the most popular traditional food in US?
New-am-04,Food,Amharic (Ethiopia),What is the most popular dipping sauce in the US?,What is the most popular dipping sauce in US?
New-am-08,Food,Amharic (Ethiopia),What is food the most commonly consumed during Christian's fasting in the US?,What food is most often consumed during Christian fasting in US?
New-am-15,Food,Amharic (Ethiopia),What food is usually prepared when mothers give birth in the US?,What food is usually prepared when mothers give birth in US?
New-am-27,Sport,Amharic (Ethiopia),Who is the most popular female sportperson in the US?,Who is the most popular female sportperson in US?
New-am-34,Education,Amharic (Ethiopia),Where do most elementary school students prepare for their exams in the US?,Where do most elementary school students prepare for their exams in US?
New-am-41,Education,Amharic (Ethiopia),"In the US, at which grade level do students take their first national-level examination?","In US, at which grade level do students take their first national-level examination?"
New-am-53,Work life,Amharic (Ethiopia),Which region in the US is widely known for its coffee/tea industry?,Which region in US is widely known for its coffee/tea industry?
New-am-54,Work life,Amharic (Ethiopia),Which region in the US is widely known for its livestock industry?,Which region in US is widely known for its livestock industry?
New-am-59,Work life,Amharic (Ethiopia),What is the main occupation of people living in deserts in the US?,What is the main occupation of people living in deserts in US?
New-am-60,Work life,Amharic (Ethiopia),Which animal is typically used for transportation in the US?,Which animal is typically used for transportation in US?
New-am-72,Family,Amharic (Ethiopia),What is the most popular comic book for children to read in the US?,What is the most popular comic book for children to read in US?
New-am-73,Family,Amharic (Ethiopia),What is the most popular YouTube channel for children in the US?,What is the most popular YouTube channel for children in US?
New-am-74,Family,Amharic (Ethiopia),What is the most popular talk show in the US?,What is the most popular talk show in US?
New-am-77,Holidays/Celebration/Leisure,Amharic (Ethiopia),What is the most famous religious holiday in the US?,What is the most famous religious holiday in US?
New-am-81,Holidays/Celebration/Leisure,Amharic (Ethiopia),"What is the busiest month for weddings in the US? (Provide Arabic numerals (e.g., 1) only.)","What is the busiest month for weddings in US? (Provide Arabic numerals (e.g., 1) only.)"
New-am-83,Holidays/Celebration/Leisure,Amharic (Ethiopia),What is the most popular traditional musical instrument in the US?,What is the most popular traditional musical instrument in US?
New-as-01,Food,Assamese (Assam),What is the main agricultural product produced in the US?,What is the main agricultural product produced in US?
New-as-02,Food,Assamese (Assam),What is the most popular wheat-based food item in the US?,What is the most popular wheat-based food item in US?
New-as-05,Food,Assamese (Assam),What is the most typical drink offered to guests when they visit households in the US?,What is the most typical drink offered to guests when they visit households in US?
New-as-07,Food,Assamese (Assam),What is the most popular dish cooked with fish in the US?,What is the most popular dish cooked with fish in US?
New-as-14,Food,Assamese (Assam),What food do people from the US like to eat during rainy weather?,What food do people from US like to eat during rainy weather?
New-as-15,Food,Assamese (Assam),What drink is commonly consumed in the US when the weather is hot?,What drink is commonly consumed in US when the weather is hot?
New-as-20,Sport,Assamese (Assam),What is the most popular indoor sport in the US?,What is the most popular indoor sport in US?
New-as-29,Sport,Assamese (Assam),What sport do men in the US like to watch?,What sport do men in US like to watch?
New-as-30,Sport,Assamese (Assam),What sport do women in the US like to watch?,What sport do women in US like to watch?
New-as-58,Work life,Assamese (Assam),What is the most popular beverage that people from the US like to drink in their workplace?,What is the most popular beverage that people from US like to drink in their workplace?
New-as-64,Family,Assamese (Assam),On which holiday do all family members tend to reunite in the US?,On which holiday do all family members tend to reunite in US?
New-as-76,Holidays/Celebration/Leisure,Assamese (Assam),What traditional games do families play during traditional holidays in the US?,What traditional games do families play during traditional holidays in US?
New-as-80,Holidays/Celebration/Leisure,Assamese (Assam),What type of clothing do people from the US wear during traditional festivals?,What type of clothing do people from US wear during traditional festivals?
New-as-89,Holidays/Celebration/Leisure,Assamese (Assam),What traditional festival accessories do people from the US wear?,What traditional festival accessories do people from US wear?
New-az-05,Food,Azerbaijani (Azerbaijan),What is the most famous region for alcohol production in the US?,What is the most famous region for alcohol production in US?
New-az-11,Food,Azerbaijani (Azerbaijan),What fruit do people from the US often eat in the summer season?,What fruit do people from US often eat in the summer season?
New-az-12,Food,Azerbaijani (Azerbaijan),Which region in the US is known for its seafood?,Which region in US is known for its seafood?
New-az-21,Sport,Azerbaijani (Azerbaijan),Which region in the US is the most popular skiing destination?,Which region in US is the most popular skiing destination?
New-az-26,Sport,Azerbaijani (Azerbaijan),Who is the most popular martial arts player in the US?,Who is the most popular martial arts player in US?
New-az-27,Sport,Azerbaijani (Azerbaijan),Which sport has been one of the fastest-growing in the US over the last decade?,Which sport has been one of the fastest-growing in US over the last decade?
New-az-39,Education,Azerbaijani (Azerbaijan),Which country is the most popular destination for students from the US studying abroad?,Which country is the most popular destination for students from US studying abroad?
New-az-49,Work life,Azerbaijani (Azerbaijan),"How many people work in a typical family in the US? (Provide Arabic numerals (e.g., 1) only.)","How many people work in a typical family in US? (Provide Arabic numerals (e.g., 1) only.)"
New-az-60,Family,Azerbaijani (Azerbaijan),"In the US, who takes care of kids when both parents are working?","In US, who takes care of kids when both parents are working?"
New-az-69,Holidays/Celebration/Leisure,Azerbaijani (Azerbaijan),What is the preferred alcoholic beverage for men from the US?,What is the preferred alcoholic beverage for men from US?
New-az-70,Holidays/Celebration/Leisure,Azerbaijani (Azerbaijan),What is the preferred alcoholic beverage for women from the US?,What is the preferred alcoholic beverage for women from US?
New-az-73,Holidays/Celebration/Leisure,Azerbaijani (Azerbaijan),"How many people on average typically attend a wedding in the US? (Provide Arabic numerals (e.g., 1) only.)","How many people on average typically attend a wedding in US? (Provide Arabic numerals (e.g., 1) only.)"
New-ch-01,Food,Chinese (China),What kind of meat do people usually eat when they have barbecue in the US?,What kind of meat do people usually eat when they have barbecue in US?
New-ch-02,Food,Chinese (China),"When do people usually have breakfast in the US? (Provide in HH:MM format (e.g., 18:00, 09:00).)","When do people usually have breakfast in US? (Provide in HH:MM format (e.g., 18:00, 09:00).)"
New-ch-04,Food,Chinese (China),What kinds of food do people usually eat for late-night snacks in the US?,What kinds of food do people usually eat for late-night snacks in US?
New-ch-05,Food,Chinese (China),What is the most famous spicy dish in the US?,What is the most famous spicy dish in US?
New-ch-07,Food,Chinese (China),What food items do people typically pair with hard liquor in the US?,What food items do people typically pair with hard liquor in US?
New-ch-08,Food,Chinese (China),What essential seasoning is indispensable in cooking in the US?,What seasoning is indispensable in cooking in US?
New-ch-09,Food,Chinese (China),What food do people typically consume when the weather is cold in the US?,What food do people typically consume when the weather is cold in US?
New-ch-13,Food,Chinese (China),What is the most famous alcohol brand in the US?,What is the most famous alcohol brand in US?
New-ch-14,Food,Chinese (China),What foods do people usually eat when they are sick in the US?,What foods do people usually eat when they are sick in US?
New-ch-15,Food,Chinese (China),What prepared/ready-to-eat food do people typically buy at supermarkets in the US?,What prepared/ready-to-eat food do people typically buy at supermarkets in US?
New-ch-16,Sport,Chinese (China),What is the most famous sports-related movie in the US?,What is the most famous sports-related movie in US?
New-ch-17,Sport,Chinese (China),What extreme sport do people generally wish to try the most in the US?,What extreme sport do people generally wish to try the most in US?
New-ch-18,Sport,Chinese (China),Which track and field event is the most popular to watch during competitions in the US?,Which track and field event is the most popular to watch during competitions in US?
New-ch-19,Sport,Chinese (China),Which gymnastics event is the most popular to watch during competitions in the US?,Which gymnastics event is the most popular to watch during competitions in US?
New-ch-23,Sport,Chinese (China),Who is the most famous table tennis player in the US?,Who is the most famous table tennis player in US?
New-ch-26,Sport,Chinese (China),"In the Winter Olympics, which event is the most popular to watch in the US?","In the Winter Olympics, which event is the most popular to watch in US?"
New-ch-27,Sport,Chinese (China),Who is the most famous boxer in the US?,Who is the most famous boxer in US?
New-ch-30,Sport,Chinese (China),Who is the most famous track and field athlete in the US?,Who is the most famous track and field athlete in US?
New-ch-31,Work life,Chinese (China),What job do parents most hope their children will pursue in the US?,What job do parents most hope their children will pursue in US?
New-ch-32,Work life,Chinese (China),What office software do people typically use in the workplace in the US?,What office software do people typically use in the workplace in US?
New-ch-38,Work life,Chinese (China),Which cities or regions are known for their import and export activities in the US?,Which cities or regions are known for their import and export activities in US?
New-ch-39,Work life,Chinese (China),What platform is commonly used in the e-commerce industry in the US?,What platform is commonly used in the e-commerce industry in US?
New-ch-44,Work life,Chinese (China),"How long is the typical probation period for new employees before signing a formal contract in the US? (e.g., 1 month).","How long is the typical probation period for new employees before signing a formal contract in US? (e.g., 1 month)."
New-ch-45,Work life,Chinese (China),Which industries do young people typically choose to start businesses in the US?,Which industries do young people typically choose to start businesses in US?
New-ch-49,Family,Chinese (China),What is the most common way for family members to communicate remotely in the US?,What is the most common way for family members to communicate remotely in US?
New-ch-51,Family,Chinese (China),What form of accommodation is typically booked for family trips in the US?,What form of accommodation is typically booked for family trips in US?
New-ch-54,Family,Chinese (China),Which fruit is usually prepared the most for family dinners in the US?,Which fruit is usually prepared the most for family dinners in US?
New-ch-64,Education,Chinese (China),"How many hours of classes do university students typically have per week in the US? (Provide Arabic numerals (e.g., 1) only.)","How many hours of classes do university students typically have per week in US? (Provide Arabic numerals (e.g., 1) only.)"
New-ch-66,Education,Chinese (China),"What is the typical tuition fee per semester for public high schools in the US?  (Provide Arabic numerals (e.g., 1) only.)","What is the typical tuition fee per semester for public high schools in US?  (Provide Arabic numerals (e.g., 1) only.)"
