ID,Topic,Source,Question,Translation
Al-en-01,Food,English (US),What is a common snack for preschool kids in the US?,What is a common snack for preschool kids in US?
Al-en-02,Food,English (US),What is a popular food to go with beer in the US?,What is a popular food to go with beer in US?
Al-en-04,Food,English (US),What is the most popular fruit in the US?,What is the most popular fruit in US?
Al-en-06,Food,English (US),What is a common school cafeteria food in the US?,What is a common school cafeteria food in US?
Al-en-08,Food,English (US),What are the most commonly eaten snacks at shopping malls in the US?,What are the most commonly eaten snacks at shopping malls in US?
Al-en-09,Food,English (US),What is a popular snack at an amusement park in the US?,What is a popular snack at an amusement park in US?
Al-en-16,Education,English (US),"At what age do kids start preschool in the US? (Provide Arabic numerals (e.g., 12) only.)","At what age do kids start preschool in US? (Provide Arabic numerals (e.g., 12) only.)"
Al-en-17,Education,English (US),What is a popular afterschool sport for elementary schools in the US?,What is a popular afterschool sport for elementary schools in US?
Al-en-18,Education,English (US),For which subject do elementary students get private education in the US?,For which subject do elementary students get private education in US?
Al-en-19,Education,English (US),What is a popular second language for high school students in the US?,What is a popular second language for high school students in US?
Al-en-21,Education,English (US),Which subject is the most important for gifted education in the US?,Which subject is the most important for gifted education in US?
Al-en-32,Holidays/Celebration/Leisure,English (US),What is the main dish for Thanksgiving in the US?,What is the main dish for Thanksgiving in US?
Al-en-33,Holidays/Celebration/Leisure,English (US),What do people do to celebrate Halloween in the US?,What do people do to celebrate Halloween in US?
Al-en-34,Holidays/Celebration/Leisure,English (US),What do people do to celebrate New Year's Day in the US?,What do people do to celebrate New Year's Day in US?
Al-en-35,Holidays/Celebration/Leisure,English (US),What do people do to celebrate Christmas in the US?,What do people do to celebrate Christmas in US?
Al-en-36,Holidays/Celebration/Leisure,English (US),What food is associated with Halloween in the US?,What food is associated with Halloween in US?
Al-en-37,Holidays/Celebration/Leisure,English (US),What food is associated with Christmas in the US?,What food is associated with Christmas in US?
Al-en-38,Holidays/Celebration/Leisure,English (US),What food is associated with Valentine's day in the US?,What food is associated with Valentine's day in US?
Al-en-39,Holidays/Celebration/Leisure,English (US),What do people eat on their birthday in the US?,What do people eat on their birthday in US?
Al-en-40,Holidays/Celebration/Leisure,English (US),What is a popular outdoor place for families to have fun with little kids in the US?,What is a popular outdoor place for families to have fun with little kids in US?
Al-en-43,Holidays/Celebration/Leisure,English (US),What is a popular indoor activity for families in the US?,What is a popular indoor activity for families in US?
An-ar-02,Education,Arabic (Algeria),Where do university students have lunch in the US?,Where do university students have lunch in US?
An-ar-03,Education,Arabic (Algeria),Which month is the final exam term usually scheduled at high schools in the US? (Provide Arabic numerals (1~12) only.),Which month is the final exam term usually scheduled at high schools in US? (Provide Arabic numerals (1~12) only.)
An-ar-08,Education,Arabic (Algeria),"How many hours a day do students in the US usually spend at high school? (Provide Arabic numerals in integers (0~24), without any decimal points.)","How many hours a day do students in US usually spend at high school? (Provide Arabic numerals in integers (0~24), without any decimal points.)"
An-ar-09,Education,Arabic (Algeria),"How many languages do students study at high school in the US? (Provide Arabic numerals (e.g., 5) only.)","How many languages do students study at high school in US? (Provide Arabic numerals (e.g., 5) only.)"
An-ar-34,Sport,Arabic (Algeria),What is the most popular sport played in a team at school in the US?,What is the most popular sport played in a team at school in US?
An-ar-35,Sport,Arabic (Algeria),Who is the most popular sport commentator in the US?,Who is the most popular sport commentator in US?
An-ar-36,Sport,Arabic (Algeria),What is the most popular sport team in the US?,What is the most popular sport team in US?
An-ar-43,Sport,Arabic (Algeria),What are the common places or venues where individuals in the US usually gather to watch sports broadcasts?,What are the common places or venues where individuals in US usually gather to watch sports broadcasts?
Ca-sp-05,Food,Spanish (Spain),"How many meals per day do people from the US usually have? (Provide Arabic numerals (e.g., 5) only.)","How many meals per day do people from US usually have? (Provide Arabic numerals (e.g., 5) only.)"
Ca-sp-06,Food,Spanish (Spain),Which is the most important meal of the day to people from the US?,Which is the most important meal of the day to people from US?
Ca-sp-08,Food,Spanish (Spain),What is the most common ingredient used in the US's diet?,What is the most common ingredient used in US's diet?
Ca-sp-09,Food,Spanish (Spain),What do people from the US usually eat for dessert?,What do people from US usually eat for dessert?
Ca-sp-11,Food,Spanish (Spain),Which day of the week do people usually organize a family meal in the US?,Which day of the week do people usually organize a family meal in US?
Ca-sp-14,Food,Spanish (Spain),Which is the most popular hot drink in the US?,Which is the most popular hot drink in US?
Ca-sp-19,Holidays/Celebration/Leisure,Spanish (Spain),What do young people from the US usually drink at the night club?,What do young people from US usually drink at the night club?
Ca-sp-21,Holidays/Celebration/Leisure,Spanish (Spain),At which month do people usually take holidays in the US? (Provide Arabic numerals (1~12) only.),At which month do people usually take holidays in US? (Provide Arabic numerals (1~12) only.)
Ca-sp-29,Holidays/Celebration/Leisure,Spanish (Spain),What tradition is there in the US for New Year's Eve?,What tradition is there in US for New Year's Eve?
Ca-sp-38,Family,Spanish (Spain),Which is the typical type of house for a family in the US?,Which is the typical type of house for a family in US?
Ca-sp-41,Family,Spanish (Spain),Where do the dependent elderly usually live in the US?,Where do the dependent elderly usually live in US?
Ca-sp-42,Family,Spanish (Spain),"How long (in weeks) is the US's maternity leave for mums? (Provide Arabic numerals (e.g., 20) only.)","How long (in weeks) is US's maternity leave for mums? (Provide Arabic numerals (e.g., 20) only.)"
Ca-sp-43,Family,Spanish (Spain),"How long (in weeks) is the US's paternity leave for dads? (Provide Arabic numerals (e.g., 20) only.)","How long (in weeks) is US's paternity leave for dads? (Provide Arabic numerals (e.g., 20) only.)"
Ca-sp-45,Family,Spanish (Spain),What type of destination is commonly chosen for a family vacation in the US?,What type of destination is commonly chosen for a family vacation in US?
Gu-ch-05,Sport,Chinese (China),What sports do seniors like the most in the US?,What sports do seniors like the most in US?
Gu-ch-06,Sport,Chinese (China),What sports do men like to play the most in the US?,What sports do men like to play the most in US?
Gu-ch-07,Sport,Chinese (China),Who is the most famous basketball player in the US?,Who is the most famous basketball player in US?
Gu-ch-08,Sport,Chinese (China),What is the most popular sports among children in the US?,What is the most popular sports among children in US?
Gu-ch-09,Sport,Chinese (China),What sports do women like to play the most in the US?,What sports do women like to play the most in US?
Gu-ch-11,Sport,Chinese (China),What sports event has the US won the most gold medals at the Olympics?,What sports event has US won the most gold medals at the Olympics?
Gu-ch-15,Sport,Chinese (China),What sports do male students in university like to play the most in the US?,What sports do male students in university like to play the most in US?
Gu-ch-16,Family,Chinese (China),"How many people are there in a family on average in the US? (Provide Arabic numerals (e.g., 12) only.)","How many people are there in a family on average in US? (Provide Arabic numerals (e.g., 12) only.)"
Gu-ch-18,Family,Chinese (China),"How many children do couples usually have in the US? (Provide Arabic numerals (e.g., 12) only.)","How many children do couples usually have in US? (Provide Arabic numerals (e.g., 12) only.)"
Gu-ch-31,Education,Chinese (China),"What is the duration of elementary school in years in the US? (Provide Arabic numerals (e.g., 12) only.)","What is the duration of elementary school in years in US? (Provide Arabic numerals (e.g., 12) only.)"
Gu-ch-32,Education,Chinese (China),"What is the duration of compulsory education in years in the US? (Provide Arabic numerals (e.g., 12) only.)","What is the duration of compulsory education in years in US? (Provide Arabic numerals (e.g., 12) only.)"
Gu-ch-33,Education,Chinese (China),"From which age do students start learning their second language in the US? (Provide Arabic numerals (e.g., 12) only.)","From which age do students start learning their second language in US? (Provide Arabic numerals (e.g., 12) only.)"
Gu-ch-38,Education,Chinese (China),"What is the duration of undergraduate education in the US? (Provide Arabic numerals (e.g., 12) only.)","What is the duration of undergraduate education in US? (Provide Arabic numerals (e.g., 12) only.)"
Gu-ch-40,Education,Chinese (China),"What time do younger elementary school students finish school in the US? (Provide in HH:MM format (e.g., 18:00, 09:00).)","What time do younger elementary school students finish school in US? (Provide in HH:MM format (e.g., 18:00, 09:00).)"
Gu-ch-41,Education,Chinese (China),"How many musical instruments do elementary school students in the US typically play? (Provide Arabic numerals (e.g., 12) only.)","How many musical instruments do elementary school students in US typically play? (Provide Arabic numerals (e.g., 12) only.)"
Ji-ko-02,Work life,Korean (South Korea),What day of the week do people in the US prefer to have company dinners?,What day of the week do people in US prefer to have company dinners?
Ji-ko-03,Work life,Korean (South Korea),Which region/city has the highest number of financial companies in the US?,Which region/city has the highest number of financial companies in US?
Ji-ko-07,Work life,Korean (South Korea),What is the most famous private company in the US?,What is the most famous private company in US?
Ji-ko-08,Work life,Korean (South Korea),"What is the maximum number of hours one can work per week in the US? (Provide Arabic numerals (e.g., 12) only.)","What is the maximum number of hours one can work per week in US? (Provide Arabic numerals (e.g., 12) only.)"
Ji-ko-09,Work life,Korean (South Korea),What do people typically eat during company get-together in the US?,What do people typically eat during company get-together in US?
Ji-ko-14,Work life,Korean (South Korea),What is the representative export item of the US?,What is the representative export item of US?
Ji-ko-15,Work life,Korean (South Korea),"How long (in hours) is the typical lunch break in the US? (Provide Arabic numerals up to one decimal point (e.g., 2, 3.5) only.)","How long (in hours) is the typical lunch break in US? (Provide Arabic numerals up to one decimal point (e.g., 2, 3.5) only.)"
Ji-ko-16,Family,Korean (South Korea),Where do mothers stay for a certain period after childbirth for recovery in the US?,Where do mothers stay for a certain period after childbirth for recovery in US?
Ji-ko-19,Family,Korean (South Korea),What is the US's most commonly given flower on Parents' Day?,What is US's most commonly given flower on Parents' Day?
Ji-ko-22,Family,Korean (South Korea),What do people especially spend their first salary on in the US's society?,What do people especially spend their first salary on in US's society?
Ji-ko-24,Family,Korean (South Korea),What is the most preferred recreational facility among children in the US?,What is the most preferred recreational facility among children in US?
Ji-ko-25,Family,Korean (South Korea),What are the family-related holidays in the US?,What are the family-related holidays in US?
Ji-ko-26,Family,Korean (South Korea),What are the key milestones associated with children's independence from their parents in the US's society?,What are the key milestones associated with children's independence from their parents in US's society?
Ji-ko-27,Family,Korean (South Korea),What is the common gift you give when visiting elderly parents in the US?,What is the common gift you give when visiting elderly parents in US?
Ji-ko-28,Family,Korean (South Korea),When is the first day that people celebrate after a child is born in the US?,When is the first day that people celebrate after a child is born in US?
Ji-ko-29,Family,Korean (South Korea),Which age's birthday is celebrated the most grandly in the US's society?,Which age's birthday is celebrated the most grandly in US's society?
Ji-ko-31,Education,Korean (South Korea),Where do middle and high school students in the US usually study for exams?,Where do middle and high school students in US usually study for exams?
Ji-ko-33,Education,Korean (South Korea),Where do high school students in the US usually go after dinner?,Where do high school students in US usually go after dinner?
Ji-ko-34,Education,Korean (South Korea),How do elementary school students in the US go to school?,How do elementary school students in US go to school?
Ji-ko-35,Education,Korean (South Korea),What is the most common form of private education in the US?,What is the most common form of private education in US?
Ji-ko-36,Education,Korean (South Korea),Which subject’s academy/private educational institute do middle or high students most frequently attend in the US?,Which subject’s academy/private educational institute do middle or high students most frequently attend in US?
Ji-ko-37,Education,Korean (South Korea),What type of clothing do middle and high school students wear to school in the US?,What type of clothing do middle and high school students wear to school in US?
Ji-ko-38,Education,Korean (South Korea),Which major is considered the most difficult to gain admission to in the US?,Which major is considered the most difficult to gain admission to in US?
Ji-ko-39,Education,Korean (South Korea),What is the most commonly learned musical instrument by elementary school students in the US?,What is the most commonly learned musical instrument by elementary school students in US?
Ji-ko-40,Education,Korean (South Korea),What do high school students typically do during break time in schools in the US?,What do high school students typically do during break time in schools in US?
Ji-ko-41,Education,Korean (South Korea),What kind of shoes do students wear in schools in the US?,What kind of shoes do students wear in schools in US?
Ji-ko-42,Education,Korean (South Korea),What are the required subjects in the US's university entrance exam?,What are the required subjects in US's university entrance exam?
Ji-ko-44,Education,Korean (South Korea),Which region (within a city) in the US has the highest academic fervor?,Which region (within a city) in US has the highest academic fervor?
Ji-ko-45,Education,Korean (South Korea),What do people look forward to the most at university festivals in the US?,What do people look forward to the most at university festivals in US?
Jo-sp-01,Sport,Spanish (Spain),What is the second most popular sport in the US?,What is the second most popular sport in US?
Jo-sp-02,Sport,Spanish (Spain),What is the most popular sport played without a ball in the US?,What is the most popular sport played without a ball in US?
Jo-sp-09,Sport,Spanish (Spain),What sports are most associated with the upper class in the US?,What sports are most associated with the upper class in US?
Jo-sp-13,Sport,Spanish (Spain),What is the most popular water sport in the US?,What is the most popular water sport in US?
Jo-sp-14,Sport,Spanish (Spain),What is the most popular mental sport in the US?,What is the most popular mental sport in US?
Jo-sp-18,Work life,Spanish (Spain),"How many holiday days per year does a standard worker gets in the US? (Provide Arabic numerals (e.g., 12) only.)","How many holiday days per year does a standard worker gets in US? (Provide Arabic numerals (e.g., 12) only.)"
Jo-sp-19,Work life,Spanish (Spain),What region in the US has been traditionally associated with agriculture?,What region in US has been traditionally associated with agriculture?
Jo-sp-21,Work life,Spanish (Spain),"What time, if any, do people usually leave work for lunch in the US? (Provide in HH:MM format (e.g., 18:00, 09:00).)","What time, if any, do people usually leave work for lunch in US? (Provide in HH:MM format (e.g., 18:00, 09:00).)"
Jo-sp-31,Education,Spanish (Spain),"What time do high school students tend to leave school in the US? (Provide in HH:MM format (e.g., 18:00, 09:00).)","What time do high school students tend to leave school in US? (Provide in HH:MM format (e.g., 18:00, 09:00).)"
Jo-sp-32,Education,Spanish (Spain),What sport do elementary school students tend to practice at school in the US?,What sport do elementary school students tend to practice at school in US?
Jo-sp-36,Education,Spanish (Spain),"How long (in weeks) are summer vacations at elementary schools in the US? (Provide in Arabic numerals (e.g., 7, 8) only.)","How long (in weeks) are summer vacations at elementary schools in US? (Provide in Arabic numerals (e.g., 7, 8) only.)"
Jo-sp-37,Education,Spanish (Spain),"How long (in weeks) are summer vacations at universities in the US? (Provide in Arabic numerals (e.g., 7, 8) only.)","How long (in weeks) are summer vacations at universities in US? (Provide in Arabic numerals (e.g., 7, 8) only.)"
Jo-sp-39,Education,Spanish (Spain),"At what age does elementary education begin in the US? (Provide in Arabic numerals (e.g., 7, 8) only.)","At what age does elementary education begin in US? (Provide in Arabic numerals (e.g., 7, 8) only.)"
Jo-sp-43,Education,Spanish (Spain),"How many languages are studied in elementary education besides the US's official language? (Provide in Arabic numerals (e.g., 7, 8) only.)","How many languages are studied in elementary education besides US's official language? (Provide in Arabic numerals (e.g., 7, 8) only.)"
Jod-ch-01,Food,Chinese (China),What eating utensils do people commonly used in the US?,What eating utensils do people commonly used in US?
Jod-ch-04,Food,Chinese (China),What soft drink do people in the US like to have?,What soft drink do people in US like to have?
Jod-ch-06,Food,Chinese (China),What is the most popular traditional alcohol in the US?,What is the most popular traditional alcohol in US?
Jod-ch-07,Food,Chinese (China),"How long (in hours) on average does it take for people in the US to have dinner at a restaurant? (Provide Arabic numerals up to one decimal point (e.g., 2, 3.5) only.)","How long (in hours) on average does it take for people in US to have dinner at a restaurant? (Provide Arabic numerals up to one decimal point (e.g., 2, 3.5) only.)"
Jod-ch-09,Food,Chinese (China),"What time do people usually have dinner in the US? (Provide in HH:MM format (e.g., 18:00, 09:00).)","What time do people usually have dinner in US? (Provide in HH:MM format (e.g., 18:00, 09:00).)"
Jod-ch-12,Food,Chinese (China),What kind of soup do people from the US like to have?,What kind of soup do people from US like to have?
Jod-ch-13,Food,Chinese (China),What street food do people from the US like to eat?,What street food do people from US like to eat?
Jod-ch-15,Food,Chinese (China),What kind of seafood do people from the US like to eat?,What kind of seafood do people from US like to eat?
Jod-ch-16,Holidays/Celebration/Leisure,Chinese (China),What is the biggest festival in the US?,What is the biggest festival in US?
Jod-ch-28,Holidays/Celebration/Leisure,Chinese (China),What is the most commonly used public transport by people when travelling between cites in the US?,What is the most commonly used public transport by people when travelling between cites in US?
Jod-ch-30,Holidays/Celebration/Leisure,Chinese (China),What are the specific decorations or symbols associated with the most biggest festival in the US?,What are the specific decorations or symbols associated with the most biggest festival in US?
Jod-ch-37,Sport,Chinese (China),What sports do women like to watch the most in the US?,What sports do women like to watch the most in US?
Jod-ch-38,Sport,Chinese (China),What sports do men like to watch the most in the US?,What sports do men like to watch the most in US?
Jod-ch-41,Holidays/Celebration/Leisure,Chinese (China),What is the common leisure activity that females in their 20s in the US engage in?,What is the common leisure activity that females in their 20s in US engage in?
Jod-ch-42,Holidays/Celebration/Leisure,Chinese (China),What is the common leisure activity that males in their 20s in the US engage in?,What is the common leisure activity that males in their 20s in US engage in?
Jod-ch-46,Work life,Chinese (China),"How long (in hours) do people usually take a break after lunch on a weekday in the US? (Provide Arabic numerals up to one decimal point (e.g., 2, 3.5) only.)","How long (in hours) do people usually take a break after lunch on a weekday in US? (Provide Arabic numerals up to one decimal point (e.g., 2, 3.5) only.)"
Jod-ch-48,Work life,Chinese (China),What do people eat for lunch during the working days in the US?,What do people eat for lunch during the working days in US?
Jod-ch-50,Work life,Chinese (China),"What is the average commute time (in minutes) for people in the US? (Provide Arabic numerals (e.g., 1) only.)","What is the average commute time (in minutes) for people in US? (Provide Arabic numerals (e.g., 1) only.)"
Jod-ch-51,Work life,Chinese (China),What is the most common transportation that people take to get to work in the US?,What is the most common transportation that people take to get to work in US?
Jod-ch-54,Work life,Chinese (China),"How long (in days) is the marriage leave in the US? (Provide Arabic numerals (e.g., 12) only.)","How long (in days) is the marriage leave in US? (Provide Arabic numerals (e.g., 12) only.)"
Jod-ch-56,Work life,Chinese (China),"What is the typical retirement age for women in the US? (Provide Arabic numerals (e.g., 12) only.)","What is the typical retirement age for women in US? (Provide Arabic numerals (e.g., 12) only.)"
Jod-ch-57,Work life,Chinese (China),"What is the typical retirement age for men in the US? (Provide Arabic numerals (e.g., 12) only.)","What is the typical retirement age for men in US? (Provide Arabic numerals (e.g., 12) only.)"
Jod-ch-58,Work life,Chinese (China),Which profession is the most respected in the US?,Which profession is the most respected in US?
Jod-ch-60,Work life,Chinese (China),What is the duration (in hours) of a typical workday in the US? (Provide Arabic numerals (0~24) only.),What is the duration (in hours) of a typical workday in US? (Provide Arabic numerals (0~24) only.)
Jod-ch-61,Work life,Chinese (China),Which occupation is most preferred among females in the US?,Which occupation is most preferred among females in US?
Jod-ch-62,Work life,Chinese (China),Which occupation is most preferred among males in the US?,Which occupation is most preferred among males in US?
Ki-pe-17,Education,Persian (Iran),"On average, how far do students typically pursue their education in the US? (e.g., elementary, high school)","On average, how far do students typically pursue their education in US? (e.g., elementary, high school)"
Ki-pe-24,Education,Persian (Iran),What language is taught in schools in the US besides English?,What language is taught in schools in US besides English?
Ki-pe-30,Education,Persian (Iran),What days of the week are schools closed in the US?,What days of the week are schools closed in US?
Ki-pe-32,Food,Persian (Iran),What food do the hosts usually prepare for the guests in the US?,What food do the hosts usually prepare for the guests in US?
Ki-pe-34,Food,Persian (Iran),What is the usual drink in the breakfast in the US?,What is the usual drink in the breakfast in US?
Ki-pe-36,Food,Persian (Iran),"Except the food original from the US, which country's food is more popular in the US?","Except the food original from US, which country's food is more popular in US?"
Ki-pe-39,Food,Persian (Iran),What food is usually prepared for a family picnic in the US?,What food is usually prepared for a family picnic in US?
Ki-pe-40,Food,Persian (Iran),Which food from the US is considered disgusting by the rest of the world?,Which food from US is considered disgusting by the rest of the world?
Ki-pe-43,Food,Persian (Iran),What is the name of the popular bread in the US?,What is the name of the popular bread in US?
Ki-pe-51,Work life,Persian (Iran),"What time of day are government offices closed in the US? (Provide in HH:MM format (e.g., 18:00, 09:00).)","What time of day are government offices closed in US? (Provide in HH:MM format (e.g., 18:00, 09:00).)"
Ki-pe-53,Work life,Persian (Iran),"What is the normal start time of government offices in the US? (Provide in HH:MM format (e.g., 18:00, 09:00).)","What is the normal start time of government offices in US? (Provide in HH:MM format (e.g., 18:00, 09:00).)"
